<?xml version="1.0" encoding="UTF-8"?>
<!DOCTYPE carte SYSTEM "carte.dtd">
<carte numero="880692310286">
    <recto>
        <photo src="img_avatar01.png"/>
        <nom>MAXIME XYZ</nom>
        <prenom>LEDUC XYZ</prenom>
        <sexe valeur="M"/>
        <naissance date="1963-12-06" lieu="Dijon"/>
        <taille>1M70</taille>
        <signature src="signature01.png"/>
    </recto>
    <verso>
        <adresse>104 RUE DES FLEURS 92100 BOULOGNE BILLANCOURT (92)</adresse>
        <date delivrance="1998-06-21" expiration="1988-06-22"/>
        <par>SOUS-PREFECTURE DE BOULOGNE BILLANCOURT (92)</par>
    </verso>
    <nationalite>
        <FRA fullname="FRANCAISE"/>
    </nationalite>
</carte>
