<?xml version="1.0" encoding="UTF-8"?>
<!DOCTYPE carte SYSTEM "carte.dtd">
<carte numero="880692310285">
    <recto>
        <photo src="img_avatar02.png"/>
        <nom>TOMAS</nom>
        <prenom>CORINE</prenom>
        <sexe valeur="F"/>
        <naissance date="1965-12-06" lieu="PARIS 1ER (75)"/>
        <taille>1M70</taille>
        <signature src="signature02.png"/>
    </recto>
    <verso>
        <adresse>104 RUE DES FLEURS 92100 BOULOGNE BILLANCOURT (92)</adresse>
        <date delivrance="1998-06-21" expiration="1988-06-22"/>
        <par>SOUS-PREFECTURE DE BOULOGNE BILLANCOURT (92)</par>
    </verso>
    <nationalite>
        <GER fullname="ALLEMANDE">
            <puce/>
        </GER>
    </nationalite>
</carte>
